,company,title,location,job posted date,job salary,summary,Experince Level,City,State,Manager,Engineer
180,SPECTRUM,Sr. Data & Reporting Analyst,"Stamford, CT 06901 (Downtown area)+3 locations",Posted1 day ago,,Integrate data from multiple sources to produce requested or required data elements.Identify and define data quality improvements.,Senior Level,Stamford, CT 06901 (Downtown area)+3 locations,0,0
181,Hartford HealthCare Corp.,Clinical Intelligence Epic Sr. Data Analyst,"Hartford, CT 06102 (Downtown area)",Posted30+ days ago,Full-time,Performs complex data analysis in support of customer requests.Turns data into information and proactively identifies opportunities based on that information.,Senior Level,Hartford, CT 06102 (Downtown area),0,0
182,AgreeYa Solutions,Sr Data Analyst,Remote,Posted5 days ago,Full-time +1,*Position: Sr. Data Analyst Location: Remote Duration: 6 + Months (could be extend) Note : * Remote position supporting west coast hours. 7 - 10…,Senior Level,Remote,,0,0
183,LOCFIT LLC,Senior SAS/Python Data Analyst (Salary up to 160k),"Temporarily Remote in Washington, DC", 3 days ago,$120000 - $160000 a year,This SAS/Python Data Analyst position is located in Washington DC. Candidates must be local or able to relocate to Washington DC area. Remote working option…,Senior Level,Temporarily Remote in Washington, DC,0,0
184,InterraIT,Looking for Data Privacy Analyst,Remote, 7 days ago,$60 - $65 an hour,"*Details: * -Proactively collects and analyzes relevant industry, regulatory, and best practice information to determine possible impacts. -Develops highly…",Senior Level,Remote,,0,0
185,Agama Solutions,Data Automation Analyst,"Summit, NJ",Posted4 days ago,$32 - $55 an hour,Qualifications: * Overall 10+ years IT industry experience. * JIRA/Confluence Proficiency. * Strong written and verbal communication skills. * Strong…,Senior Level,Summit, NJ,0,0
186,Insurity,Sr. Business Analyst,"Temporarily Remote in Hartford, CT+1 location",Posted12 days ago,,"Accurately estimate analyst work efforts.Familiar with data mapping for API interfaces.Coaching, training, and mentoring other analysts.",Senior Level,Temporarily Remote in Hartford, CT+1 location,0,0
187,Insight Global,Sr. Data Analyst,"Atlanta, GA 30346+1 location",Posted4 days ago,,Extensive experience working with and analyzing data and data quality at the requirements stage.Experience working with Product Managers/Product Owners to…,Senior Level,Atlanta, GA 30346+1 location,0,0
188,Frontier Communications,"Director, Data Analytics","Dallas-Fort Worth, TX+2 locations",Posted30+ days ago,,7+ years experience in data analytics and modeling.Partner cross-functionally to solve problems with creative insights from quantitative and qualitative data…,Senior Level,Dallas-Fort Worth, TX+2 locations,0,0
189,ERIKS NA,Sr. IT Business Analyst - Customer Service Focus,Remote, 4 days ago,Full-time,"A strong understanding of data, data structures, software/ERP configuration via soft-coding is required.ERP sales order processes and related areas of business…",Senior Level,Remote,,0,0
190,Central Point Partners,Senior Project Data Analyst,"Hybrid remote in New Albany, OH",Posted7 days ago,From $38 an hour,"Provide framework for enforcing data integrity rules during data entry.Working with IT Support, provide framework for updating data for data correction…",Senior Level,Hybrid remote in New Albany, OH,0,0
191,"TekPartners, A P2P Company",Sr. Data Warehouse Analyst,"Lake Mary, FL 32746",Posted12 days ago,$51 an hour,Expert knowledge of GUI based ETL and workflow automation tools are required to efficiently manipulate data in the data warehouse.,Senior Level,Lake Mary, FL 32746,0,0
192,Vaco,Senior Data Analyst | Upto $70/hr,"Oakland, CA",Posted27 days ago,Up to $70 an hour,"We are looking for a candidate with strong SQL, python, and data visualization skills.**Must be in Oakland, CA or commutable distance***.",Senior Level,Oakland, CA,0,0
193,Fasa para Sparrow Company,newBI Data Analyst,"Ontario, CA",PostedJust posted,$70000 - $80000 a year,"Reporting of information from Integra, dispatching software product of Command Alkon.Equipment Utilization and Plant Production Reports.",,Ontario, CA,0,0
194,Snappyhires,newData Analyst Infomatica,Remote,PostedJust posted,$35 - $47 an hour,Partner with core data engineering teams to consistently evolve data models based on growing business and engineering needs.,,Remote,,0,0
195,Hastings Mutual Insurance Company,Business Analyst,"Hastings, MI 49058",Posted30+ days ago,Full-time,"Highly motivated, self-directed, logical, efficient, and keen attention to detail.The individual in this role will elicit, analyze, specify, and validate the…",,Hastings, MI 49058,0,0
196,Orgspire Info Technologies Pvt. Ltd.,newInformatica (ETL) Data Analyst,Remote,PostedJust posted,$47 - $52 an hour,"Key Skills: * Informatica (ETL), Data analysis.Strong Data Analyst experience ~ 4+ years.ETL background ( informatica/datastage / IICS).",,Remote,,0,0
197,Milam's Market,Human Resources Analyst,"Miami Springs, FL 33166",Posted30+ days ago,$25 an hour,"Ensures compliance with data privacy regulations and best practices.Prepares reports of data results, presenting and explaining findings to senior leadership.",,Miami Springs, FL 33166,0,0
198,Altice USA,newCompliance Analyst Virtual Hiring Event,"Merrick, NY 11566+7 locations",Posted5 days ago,Full-time,Reviews data to identify basic trends and analysis.Must be able to analyze and present insight from informational data.Data mining and querying preferred.,,Merrick, NY 11566+7 locations,0,0
199,Stafug,newData/Business Analyst,"Remote in California City, CA+3 locations",PostedJust posted,$55 - $65 an hour,"Documenting data flows at different levels.Experience working directly with senior stakeholders to identify data requirements.Job Types: Full-time, Part-time.",,Remote in California City, CA+3 locations,0,0
200,"Entegris, Inc.",newData Analyst,"Round Rock, TX 78665+1 location",Posted7 days ago,Full-time,Establish & maintain methods that enable data visualization to derive business insights and ‘tells the story’.Never satisfied with the status quo;,,Round Rock, TX 78665+1 location,0,0
201,"Prime Trust, LLC",Data Analyst II,Remote,EmployerActive 2 days ago,$75000 - $80000 a year,"5+ years industry experience as a business analyst, data analyst, data governance analyst, or in a data quality management role.Job Type: *Full-time position.",,Remote,,0,0
202,Infipact,newData Analyst,Remote,Posted7 days ago,$50 - $55 an hour,"5+ years of exp in writing complex SQL queries- strong SQL experience.5+ years of work experience on Oracle platform.Job Types: Full-time, Contract.",,Remote,,0,0
203,Anthem Sports & Entertainment,newData Analyst,Temporarily Remote,PostedJust posted,Up to $75000 a year,The successful candidate will have a minimum of 3-5 years previous experience as a Digital Business Analyst.Coordinate onboarding of new channels.,,Temporarily Remote,,0,0
204,Cilable,newData Analyst - REMOTE,+1 locationRemote,Posted5 days ago,Up to $30 an hour,"The candidate will assist the Data Governance Program manager in the delivery of all data governance projects and initiatives.Job Types: Full-time, Contract.",,+1 locationRemote,,0,0
205,Rohatech llc,newData Analyst - Tableau,+1 locationRemote,PostedToday,Full-time +1,"12 Month Contract - Potential For Extension or Conversion.Create Visualization for Business Team.Job Types: Full-time, Contract.",,+1 locationRemote,,0,0
206,The Standard,Data Analyst (EXCEL EXPERT) REMOTE,"Remote in New York, NY",EmployerActive 11 days ago,$24 an hour,Solar company seeks data entry analyst for a remote position - must live locally in NY State.Review and analyze data with senior management weekly.,,Remote in New York, NY,0,0
207,Bobcat Company,newData Science Analyst,"West Fargo, ND 58078+1 location",PostedToday,Full-time,"Data & statistical analysis: 1 year (Preferred).Relational data management and reporting tools, such as Power BI or Tableau.Python or R: 1 year (Preferred).",,West Fargo, ND 58078+1 location,0,0
208,Phoenix Marketing International,Part-Time Data Production Analyst,+1 locationRemote,EmployerActive 1 day ago,Part-time,This position is an overnight shift from 9:00 PM (ET) - 3:00 AM (ET); 5 days per week; some flexibility is available.Part-Time Data Production Analyst: *.,,+1 locationRemote,,0,0
209,The Home Depot,newCybersecurity Analyst (Remote),"Remote in Atlanta, GA+1 location",Posted1 day ago,Full-time,"Collaborates with cross functional teams to collect, analyze data, presents results and provides recommendations.Must be eighteen years of age or older.",,Remote in Atlanta, GA+1 location,0,0
210,Besler & Company Inc.,Claims Investigation Analyst Jr. - Remote,Remote,EmployerActive 4 days ago,From $15.50 an hour,Analyze data in excel spreadsheets.Analyze and format client data files in a timely manner.We are currently seeking a Claims Investigation Jr. Analysts to…,,Remote,,0,0
211,PCI Health,newEntry Level Data Analyst,"Fort Smith, AR+1 location",Posted5 days ago,$13 - $16 an hour,Experience working with large amounts of data.This role will support the technical infrastructure of our telehealth organization by filtering and organizing…,,Fort Smith, AR+1 location,0,0
212,DISYS,newJr. Data Analyst,"Lutz, FL+5 locations",Posted4 days ago,$22 - $26 an hour,"Provide quality assurance of imported data, working with quality assurance analyst if necessary.Supporting initiatives for data integrity and normalization.",,Lutz, FL+5 locations,0,0
213,Broadly,newData Analyst,Remote,EmployerActive 7 days ago,$66255 - $145111 a year,Position Summary: *The data delivery analyst playsan important part in our operations to ensure high quality data in our business systems and develop processes…,,Remote,,0,0
214,ALLCARE HEALTH,Credentialing Analyst,Remote,EmployerActive 2 days ago,Full-time,Looking for a full time remote data analyst*.Enters and maintains provider credentialing information in the health plans credentialing system including…,,Remote,,0,0
215,FSA Federal,Data Analyst Supporting the FBI,"Minneapolis, MN 55430+15 locations",Posted30+ days ago,$23.06 an hour,"Accurately enters required data into one or more databases, documents, or spreadsheets.Attention to detail and the ability to read and follow directions is…",,Minneapolis, MN 55430+15 locations,0,0
216,Synchrony Financial,Credit Analyst,"Draper, UT+9 locations",Posted11 days ago,$75000 - $150000 a year,Familiarity with any data visualization tools like TABLEAU.This is a great opportunity for someone who is a modeler/statistician/data analyst/coder (or a…,,Draper, UT+9 locations,0,0
217,CorTech,Data Analyst 1,"Columbia, SC",Posted27 days ago,$16 - $18 an hour,Review all system generated errors based on data entry standards.Identify and correct data entry errors in a timely manner to ensure inclusion of information…,,Columbia, SC,0,0
218,RemX,newJunior Data Entry Analyst,"Remote in Glen Allen, VA",PostedJust posted,,"Previous data entry, data analysis and customer service experience or equivalent combination of education and experience.Ensures accuracy and quality of data.",,Remote in Glen Allen, VA,0,0
219,American Unit,Data Protection Analyst,"New York, NY",EmployerActive 6 days ago,$60 - $65 an hour,Symantec is the biggest must have - otherwise need 10+ years of endpoint protection exp.Symantec SME manage security tools production support any antimalware…,,New York, NY,0,0
220,Discover,newBusiness Intelligence Analyst,"Riverwoods, IL 60015",PostedToday,Full-time,"Familiar with data modeling concept.Python programming experience with data manipulation and ETL process.2+ years hands on experience developing optimized,…",,Riverwoods, IL 60015,0,0
221,"NAE/NWAN, A Portfolio Company",Junior Risk Analyst (Texas),"Dallas, TX 75254 (Far North area)+2 locations",Posted13 days ago,$19 - $22 an hour,"May include independent research or analysis of additional data.3 to 4 years of experience working with a self-service tool, preferably Power BI.",,Dallas, TX 75254 (Far North area)+2 locations,0,0
222,Accuro Group,newData Intelligence Analyst,Temporarily Remote,EmployerActive 4 days ago,$60 - $65 an hour,"Understanding of data lineage, metadata as related to data management capabilities.Informatica EDC data model (CNB).ASG Technology: 3 years (Preferred).",,Temporarily Remote,,0,0
223,Ascendo Resources,newData Analyst,Remote+3 locations,PostedJust posted,$75000 a year,"Developing and maintaining databases, data systems – reorganizing data in a readable format.Performing analysis to assess quality and meaning of data.",,Remote+3 locations,,0,0
224,Lockton Companies - Property & Casualty Insurance,Data Analyst,"Hybrid remote in Kansas City, MO",EmployerActive 7 days ago,$65000 - $90000 a year,Maintains data integrity and data processing efficiency by working to eliminate redundancy and applying best practice data stewardship techniques.,,Hybrid remote in Kansas City, MO,0,0
225,"ASAP Solutions Group, LLC",newJr. Data Analyst ($33-$37/hr),Remote,PostedJust posted,$33 - $37 an hour,"We’re looking for someone with 3-5 years of experience in a position monitoring, managing, manipulating and drawing insights from data.",,Remote,,0,0
226,Velo IT Solutions,newData Governance Analyst,Remote,EmployerActive 5 days ago,$70 - $80 an hour,"Includes providing data for ad-hoc data requests.Data Management - Implementing and maintaining data standards, business glossaries / data dictionaries to…",,Remote,,0,0
227,X2Logics,newSr. Data Analyst,Remote,PostedJust posted,$60 - $65 an hour,"We are looking for a data analyst who will be responsible for coordinating the changes to computer databases, test, and implement the database applying…",,Remote,,0,0
228,MealPal,Junior Data Analyst,"New York, NY",Posted18 days ago,,️ Mine data for answers to business challenges.️ Develop insights and recommend business strategy based on data.This role is ideal for a 2022 College Grad.,,New York, NY,0,0
229,Adept Consultants,newData analyst with Banking and Data Migration Program / Proje...,Remote,PostedJust posted,$60 an hour,Clearly articulate the definition of data and help understand the logical and physical representation.Must have prior experience in banking.,,Remote,,0,0
230,Eteam Infoservices Private Limited,Data Analyst,+1 locationRemote,Posted30+ days ago,$50 - $63 an hour,"Aggregates data from multiple data sources, including Workday,.5+ years of experience in data analytics/reporting.Job Types: Full-time, Contract.",,+1 locationRemote,,0,0
231,Infologitech,newData Analyst,"Raleigh, NC (North Central area)",EmployerActive 4 days ago,$70 - $75 an hour,"Strong interest in playing a technical data steward role across our business and technology partners to understand and detail our data, appropriate Required 3…",,Raleigh, NC (North Central area),0,0
232,Computershare,Data System Analyst,Remote in Colorado,Posted12 days ago,$70000 - $85000 a year,"Collecting and reviewing data files, including Sale Files, Prefund Files and Loan Substitution Files to ensure Loan Accounting, Inventory Management and…",,Remote in Colorado,,0,0
233,GMH Asphalt Corporation,"newAP/AR, data entry and cost analyst","Chaska, MN 55318",EmployerActive 5 days ago,$20 - $23 an hour,"Accurate entry of data for Job Costing.Daily timecard entry, prep work for payroll.Daily reconciliation of materials and trucking.",,Chaska, MN 55318,0,0
234,"Dovenmuehle Mortgage, Inc.",Data Integration Analyst,"Lake Zurich, IL 60047+1 location",EmployerActive 7 days ago,From $40000 a year,"Maintain accurate and timely communication with sub-servicing clients, prior service's, and internal department personnel to ensure minimal impact to clients…",,Lake Zurich, IL 60047+1 location,0,0
235,Carpenter Technology,Global Commercial Business & Data Solutions Analyst,"Reading, PA 19601",Posted30+ days ago,Full-time,"Defects/break fix for data loads and validations.Assist with Governance Toolset development, unit testing and integration testing.",,Reading, PA 19601,0,0
236,Texas Children's Hospital,Business Intelligence Analyst,"Bellaire, TX 77401",Posted30+ days ago,,"You’ll also develop into a subject matter expert in Health Plan data and its transformation into analytics and business intelligence, working on assignments of…",,Bellaire, TX 77401,0,0
237,FSA Federal,Data Analyst Supporting the FBI,"New York, NY 10007 (Tribeca area)+15 locations",Posted30+ days ago,$26.92 an hour,"Accurately enters required data into one or more databases, documents, or spreadsheets.Attention to detail and the ability to read and follow directions is…",,New York, NY 10007 (Tribeca area)+15 locations,0,0
238,South Shore Health,Data Quality Analyst (HIM/Medical Records),"Weymouth, MA 02190 (South Weymouth area)",Posted30+ days ago,Part-time,"Under general supervision, reviews medical records to ensure that records are complete and all appropriate documentation is present.",,Weymouth, MA 02190 (South Weymouth area),0,0
239,Cleveland Clinic,Kronos/Qgenda Systems Data Analyst II,"Cleveland, OH 44195 (Fairfax area)+1 location",Posted27 days ago,,Minimum of 3 year of data statistical analysis experience.Ensures data requirements are met and data is extracted efficiently to provide accurate reports.,,Cleveland, OH 44195 (Fairfax area)+1 location,0,0
240,ASK Consulting,newResearch Operations/ Data Analyst Engineer,Remote,PostedJust posted,$69 - $71 an hour,"Architect system from multiple data sources.Perform ETL to blend data sources through manual and automated processes.Database design, management and support.",,Remote,,0,1
241,American Homes 4 Rent,Data Analyst (Remote),"Remote in Las Vegas, NV",Posted30+ days ago,$60000 - $86000 a year,"Extracts data from primary and secondary sources and assess the quality and meaning of data, translates data into a readable format.(This is a remote role).",,Remote in Las Vegas, NV,0,0
242,DISYS,newJunior Data Analyst,"Tampa, FL+18 locations",PostedToday,$26 an hour,"Provide quality assurance of imported data, working with quality assurance analyst if necessary.Supporting initiatives for data integrity and normalization.",,Tampa, FL+18 locations,0,0
243,BusiApp Corp,newJr Marketplace Data Analyst,"Hybrid remote in Morrisville, NC",PostedJust posted,$35000 - $45000 a year,This full time salary position is 8-5 Monday-Friday.*.Utilizing advanced formulas in Excel and Sheets to analyze market research data.,,Hybrid remote in Morrisville, NC,0,0
244,DISYS,newJr. Data Analyst,"Tampa, FL+5 locations",Posted4 days ago,$22 - $26 an hour,"Provide quality assurance of imported data, working with quality assurance analyst if necessary.Supporting initiatives for data integrity and normalization.",,Tampa, FL+5 locations,0,0
245,FSA Federal,Data Analyst Supporting the FBI,"Minneapolis, MN 55430+14 locations",Posted30+ days ago,$23.06 an hour,"Accurately enters required data into one or more databases, documents, or spreadsheets.Attention to detail and the ability to read and follow directions is…",,Minneapolis, MN 55430+14 locations,0,0
246,FSA Federal,Data Analyst Supporting the FBI Health Care Fraud Unit,"Washington, DC 20004 (Penn Quarter area)",Posted30+ days ago,$25.29 an hour,"Accurately enters required data into one or more databases, documents, or spreadsheets.Attention to detail and the ability to read and follow directions is…",,Washington, DC 20004 (Penn Quarter area),0,0
247,American Homes 4 Rent,Data Analyst (Remote),"Remote in Las Vegas, NV+3 locations",Posted30+ days ago,$60000 - $86000 a year,"Extracts data from primary and secondary sources and assess the quality and meaning of data, translates data into a readable format.(This is a remote role).",,Remote in Las Vegas, NV+3 locations,0,0
248,Amazon.com Services LLC,ICQA Data Analyst,"West Columbia, SC",Posted30+ days ago,Full-time,"Development of data collection processes and data management systems.Initiative to develop tools, data collection processes, and data management systems.",,West Columbia, SC,0,0
249,Amanda Blu & Company,newData Maintenance & Analyst:,"Shawnee, KS 66227",PostedToday,$50000 - $60000 a year,Developing and maintaining databases and data systems.Performing analysis to assess quality and meaning of data.401(k) with company matching.,,Shawnee, KS 66227,0,0
250,First American,"newData Quality Analyst - Remote, AZ","Remote in Phoenix, AZ+1 location",Posted3 days ago,,"Assist in correcting minor data quality errors.Must be able to understand business rules, work with varying data formats, and develop metrics and audit…",,Remote in Phoenix, AZ+1 location,0,0
251,DISYS,newJr. Data Analyst,"Riverview, FL+5 locations",Posted4 days ago,$22 - $26 an hour,"Provide quality assurance of imported data, working with quality assurance analyst if necessary.Supporting initiatives for data integrity and normalization.",,Riverview, FL+5 locations,0,0
252,FSA Federal,Data Analyst Supporting the DEA,"Guaynabo, PR 00968+15 locations",Posted30+ days ago,$13.48 an hour,"Accurately enters required data into one or more databases, documents, or spreadsheets.Attention to detail and the ability to read and follow directions is…",,Guaynabo, PR 00968+15 locations,0,0
253,"Fiserv, Inc.",Data Entry Analyst,"Wilmington, DE",Posted13 days ago,Full-time,"0-5 years of an equivalent combination of educational background, related experience and/or military experience.Working hours will be 9am - 6pm EST.",,Wilmington, DE,0,0
254,The Institute for Advanced Learning and Research,Research and Data Analyst for Southern Virginia Region,"Danville, VA 24540",EmployerActive 6 days ago,$406 a week,"While there is not a specific age or educational requirement, experience with collecting and disseminating data or utilizing social medial and Microsoft Office…",,Danville, VA 24540,0,0
255,VeriHygene Inc,Data Analyst / Processor,"Laurel, MD",EmployerActive 2 days ago,$21 - $29 an hour,"Identify and interpret patterns and trends, assess data quality and eliminate irrelevant data.Must have at least 2 years’ experience working as an analyst in a…",,Laurel, MD,0,0
256,Snappyhires,newData Analyst Infomatica,Remote,PostedJust posted,$35 - $47 an hour,Partner with core data engineering teams to consistently evolve data models based on growing business and engineering needs.Pay: $35.00 - $47.00 per hour.,,Remote,,0,0
257,Technology Enhanced Learning & Living (TELL)...,Board Certified Behavior Analyst BCBA LBA,"Austin, TX",EmployerActive 3 days ago,Up to $80000 a year,"* analyze data to determine when, where and the function of problem behaviors.BCBA-Board Certified Behavior Analyst .Organize and Maintain Records (10%).",,Austin, TX,0,0
258,Orgspire Info Technologies Pvt. Ltd.,newInformatica (ETL) Data Analyst,Remote,PostedJust posted,$47 - $52 an hour,"Work Authorization: * Only Independent Contractors.Key Skills: * Informatica (ETL), Data analysis.Strong Data Analyst experience ~ 4+ years.",,Remote,,0,0
259,Stafug,newData/Business Analyst,"Remote in California City, CA+3 locations",PostedJust posted,$55 - $65 an hour,"In addition, you will provide insight to other data analysts, data architects, and application developers to create an enterprise data model that meets business…",,Remote in California City, CA+3 locations,0,0
260,KWx,BI Analyst - KWx,"Austin, TX",Posted30+ days ago,Full-time,"Develop a deep, insightful understanding of our organizational data and 3rd party data.Build and deploy great data solutions.WHO WE ARE: ONE TEAM.",,Austin, TX,0,0
261,Infipact,newData Analyst,Remote,Posted7 days ago,$50 - $55 an hour,"Location : - Fremont, CA (Remote until Covid subsides).5+ years of exp in writing complex SQL queries- strong SQL experience.Job Types: Full-time, Contract.",,Remote,,0,0
262,Auto Approve,newSenior Business Intelligence Analyst,"Minneapolis, MN 55430",Posted8 days ago,Full-time,Data governance and data education design and processes for managing data.Research and locate systems and data.About The Team And Position.,,Minneapolis, MN 55430,0,0
263,Rohatech llc,newData Analyst - Tableau,+1 locationRemote,PostedToday,Full-time +1,"12 Month Contract - Potential For Extension or Conversion.Create Visualization for Business Team.Job Types: Full-time, Contract.Pay: $1.00 - $60.00 per hour.",,+1 locationRemote,,0,0
264,Bobcat Company,newData Science Analyst,"West Fargo, ND 58078+1 location",PostedToday,Full-time,"Data & statistical analysis: 1 year (Preferred).Experience Required: 0-5 Years.Relational data management and reporting tools, such as Power BI or Tableau.",,West Fargo, ND 58078+1 location,0,0
265,DISYS,newData Analyst,"Tampa, FL 33619+12 locations",PostedToday,$24 - $26 an hour,"Provide quality assurance of imported data, working with quality assurance analyst if necessary.Supporting initiatives for data integrity and normalization.",,Tampa, FL 33619+12 locations,0,0
266,Procom,newData Entry Analyst - 331923,"Getzville, NY",Posted4 days ago,Contract,Assist team members with procedural tasks such as creating/closing accounts and updating static data on existing customers.ASAP – 6 months to start.,,Getzville, NY,0,0
267,Internal Data Resources,newData Analyst,Remote,Posted1 day ago,Full-time,2+ years of SQL querying data and building data pipelines.Creating end-to-end data pipelines and ETL solutions to create accessible data sets.,,Remote,,0,0
268,Eteam Infoservices Private Limited,Data Analyst,+1 locationRemote,Posted30+ days ago,$50 - $63 an hour,"Aggregates data from multiple data sources, including Workday,.5+ years of experience in data analytics/reporting.What is the expected work schedule?",,+1 locationRemote,,0,0
