,company,title,location,job posted date,job salary,summary,Experince Level,City,State,Manager,Engineer
0,Bobcat Company,Data Science Analyst,"West Fargo, ND 58078",PostedToday,Full-time,"Data & statistical analysis: 1 year (Preferred).Experience Required: 0-5 Years.Relational data management and reporting tools, such as Power BI or Tableau.",Entry Level,West Fargo, ND 58078,0,0
1,Ascendo Resources,Data Analyst,Remote+2 locations,PostedJust posted,$75000 a year,"Developing and maintaining databases, data systems – reorganizing data in a readable format.Performing analysis to assess quality and meaning of data.",Entry Level,Remote+2 locations,,0,0
2,Stafug,Data/Business Analyst,+2 locationsRemote,PostedJust posted,$55 - $65 an hour,"In addition, you will provide insight to other data analysts, data architects, and application developers to create an enterprise data model that meets business…",Entry Level,+2 locationsRemote,,0,0
3,Rohatech llc,Data Analyst - Tableau,Remote,PostedJust posted,Full-time +1,"12 Month Contract - Potential For Extension or Conversion.Create Visualization for Business Team.Job Types: Full-time, Contract.Pay: $1.00 - $60.00 per hour.",Entry Level,Remote,,0,0
4,Procom,Data Entry Analyst - 331923,"Getzville, NY",Posted4 days ago,Contract,Assist team members with procedural tasks such as creating/closing accounts and updating static data on existing customers.Data Entry - Assignment Start Date.,Entry Level,Getzville, NY,0,0
5,Cilable,Data Analyst - REMOTE,Remote,Posted5 days ago,Up to $30 an hour,"The candidate will assist the Data Governance Program manager in the delivery of all data governance projects and initiatives.Job Types: Full-time, Contract.",Entry Level,Remote,,0,0
6,PCR,Data Feed Analyst,Remote, 8 days ago,$75000 - $110000 a year,Review and verify accuracy of data.The Operations Associate will be responsible for providing client with continuous support related to data and reporting…,Entry Level,Remote,,0,0
7,MealPal,Junior Data Analyst,"New York, NY",Posted18 days ago,,️ Mine data for answers to business challenges.Are you a data-driven problem solver?️ Develop insights and recommend business strategy based on data.,Entry Level,New York, NY,0,0
8,Broadly,Data Analyst,Remote, 7 days ago,$66255 - $145111 a year,Position Summary: *The data delivery analyst playsan important part in our operations to ensure high quality data in our business systems and develop processes…,Entry Level,Remote,,0,0
9,Acrometis,Data Analyst,Remote, 2 days ago,$80000 - $100000 a year,Proven working experience as a data analyst or business data analyst.Acquire data from primary or secondary data sources and maintain databases/data systems.,Entry Level,Remote,,0,0
10,Shaker,Junior Data Analyst,Remote,Posted30+ days ago,,"Due to growing client demand, we have opportunities for data analysts at the junior, mid-, and senior levels.Remote | HQ in Oak Park, IL.",Entry Level,Remote,,0,0
11,6elm Capital,Data Analyst,"New York, NY 10003 (Flatiron area)",Posted5 days ago,$80000 - $100000 a year,Investigate and defuse time-sensitive data incidents.Communicate with data providers to onboard new datasets and troubleshoot technical issues.,Entry Level,New York, NY 10003 (Flatiron area),0,0
12,University of Kentucky,Institutional Data Analyst Associate,"Lexington, KY",Posted4 days ago,$18.80 - $30.09 an hour,"In addition to e-procurement support, the successful candidate will perform data reporting across both internal and external data sources relating to…",Entry Level,Lexington, KY,0,0
13,American Unit,Data Protection Analyst,"New York, NY", 6 days ago,$60 - $65 an hour,IV process - panel one and done Pittsburgh or NY local.Symantec is the biggest must have - otherwise need 10+ years of endpoint protection exp.,Entry Level,New York, NY,0,0
14,Helm,Data Analyst,"Plymouth, MI", 11 days ago,$80000 - $90000 a year,\*One must be excited and encouraged to work with multiple levels of stakeholders to make data actionable and ensure data integrity.Who are we looking for?*.,Entry Level,Plymouth, MI,0,0
15,Stafug,Data/Business Analyst,+2 locationsRemote,PostedJust posted,$55 - $65 an hour,"Documenting data flows at different levels.Experience working directly with senior stakeholders to identify data requirements.Job Types: Full-time, Part-time.",Entry Level,+2 locationsRemote,,0,0
16,Rohatech llc,Data Analyst - Tableau,Remote,PostedJust posted,Full-time +1,"12 Month Contract - Potential For Extension or Conversion.Create Visualization for Business Team.Job Types: Full-time, Contract.",Entry Level,Remote,,0,0
17,DISYS,Data Analyst,"Tampa, FL 33619+11 locations",PostedToday,$24 - $26 an hour,"Provide quality assurance of imported data, working with quality assurance analyst if necessary.Supporting initiatives for data integrity and normalization.",Entry Level,Tampa, FL 33619+11 locations,0,0
18,Bobcat Company,Data Science Analyst,"West Fargo, ND 58078",PostedToday,Full-time,"Data & statistical analysis: 1 year (Preferred).Relational data management and reporting tools, such as Power BI or Tableau.Python or R: 1 year (Preferred).",Entry Level,West Fargo, ND 58078,0,0
19,MealPal,Junior Data Analyst,"New York, NY",Posted18 days ago,,️ Mine data for answers to business challenges.️ Develop insights and recommend business strategy based on data.This role is ideal for a 2022 College Grad.,Entry Level,New York, NY,0,0
20,Helm,Data Analyst,"Plymouth, MI", 11 days ago,$80000 - $90000 a year,"Interpret data and analyze results using statistical techniques.Identify, analyze, and interpret trends or patterns in complex data sets.",Entry Level,Plymouth, MI,0,0
21,Purple Drive Technologies,Data Analyst,"Redmond, WA", 4 days ago,Full-time +1,"Participate in continuous process improvements focused on systems, reporting, and data analysis efficiencies.Business coordination with multiple stakeholders.",Entry Level,Redmond, WA,0,0
22,Shaker,Junior Data Analyst,Remote,Posted30+ days ago,,"Due to growing client demand, we have opportunities for data analysts at the junior, mid-, and senior levels.Familiarity with Tableau or other BI tools.",Entry Level,Remote,,0,0
23,Beacon Systems,Data Analyst,Remote,Posted4 days ago,Full-time +1,"Using methods of exploratory data analysis and demonstrating ability to identify when data is insufficient to reach conclusions.Job Types: Full-time, Contract.",Entry Level,Remote,,0,0
24,Fasa para Sparrow Company,BI Data Analyst,"Ontario, CA",PostedJust posted,$70000 - $80000 a year,"Reporting of information from Integra, dispatching software product of Command Alkon.Equipment Utilization and Plant Production Reports.",Entry Level,Ontario, CA,0,0
25,"Infinity Consulting Solutions, Inc.",Jr. Data Analyst - Remote,Remote in Illinois,Posted24 days ago,$20 - $25 an hour,"The Jr. Data Analyst will be responsible to review daily, monthly, and yearly data thoroughly, performing trend analysis and highlighting variances of…",Entry Level,Remote in Illinois,,0,0
26,Synergis,PowerBI Developer / Infrastructure Data Analyst,Remote,PostedToday,$50 - $60 an hour,"Meeting with IS analysts and other TO analysts to discuss and review solutions.Data deep dives to validate data is accurate.Job Types: Full-time, Contract.",Entry Level,Remote,,0,0
27,Microsoft,Data Analyst – Enterprise Data,"Remote in Redmond, WA",Posted10 days ago,Full-time,Work with data engineers to operationalize dashboards and ingest new data sources (provide data modeling requirements).,Entry Level,Remote in Redmond, WA,0,0
28,Stafug,Data/Business Analyst,+3 locationsRemote,PostedJust posted,$55 - $65 an hour,"Documenting data flows at different levels.Experience working directly with senior stakeholders to identify data requirements.Job Types: Full-time, Part-time.",Entry Level,+3 locationsRemote,,0,0
29,DISYS,Data Analyst,"Tampa, FL 33619+31 locations",PostedToday,$24 - $26 an hour,"Provide quality assurance of imported data, working with quality assurance analyst if necessary.Supporting initiatives for data integrity and normalization.",Entry Level,Tampa, FL 33619+31 locations,0,0
30,Digitas,"Analyst, Data and Analysis","New York, NY 10104 (Midtown area)+3 locations",Posted7 days ago,Internship,"✦ Identifying nuances in data to optimize our clients’ business.We are the connected marketing agency, a full-service agency with modern creative & media, data…",Entry Level,New York, NY 10104 (Midtown area)+3 locations,0,0
31,University of Kentucky,Institutional Data Analyst Associate,"Lexington, KY+1 location",Posted4 days ago,$18.80 - $30.09 an hour,"In addition to e-procurement support, the successful candidate will perform data reporting across both internal and external data sources relating to…",Entry Level,Lexington, KY+1 location,0,0
32,Procom,Data Entry Analyst - 331923,"Getzville, NY",Posted4 days ago,Contract,Assist team members with procedural tasks such as creating/closing accounts and updating static data on existing customers.ASAP – 6 months to start.,Entry Level,Getzville, NY,0,0
33,DISYS,Junior Data Analyst,"Riverview, FL+18 locations",PostedToday,$26 an hour,"Provide quality assurance of imported data, working with quality assurance analyst if necessary.Supporting initiatives for data integrity and normalization.",Entry Level,Riverview, FL+18 locations,0,0
34,DISYS,Data Analyst,"Tampa, FL+11 locations",Hiring ongoing,$25 - $27 an hour,"Provide quality assurance of imported data, working with quality assurance analyst if necessary.Supporting initiatives for data integrity and normalization.",Entry Level,Tampa, FL+11 locations,0,0
35,DFS,Data Analyst - Entry Level,"Wilmington, DE 19801 (Southbridge area)",PostedToday,$16 - $19 an hour,"Ideal candidates are willing to go the extra mile, thrive in a fast paced environment, remain focused, and recall necessary data.",Entry Level,Wilmington, DE 19801 (Southbridge area),0,0
36,DISYS,Junior Data Analyst,"Tampa, FL+18 locations",PostedToday,$26 an hour,"Provide quality assurance of imported data, working with quality assurance analyst if necessary.Supporting initiatives for data integrity and normalization.",Entry Level,Tampa, FL+18 locations,0,0
37,DISYS,Data Analyst,"Tampa, FL+11 locations",Posted4 days ago,$25 - $27 an hour,"Provide quality assurance of imported data, working with quality assurance analyst if necessary.Supporting initiatives for data integrity and normalization.",Entry Level,Tampa, FL+11 locations,0,0
38,Robert Half,Data Analyst,"Fort Worth, TX+1 location",Posted5 days ago,$65000 - $75000 a year,Set and maintain item vendor master data.Special projects as required (e.g. Convert data from acquisition ERP system into McRey ERP system).,Entry Level,Fort Worth, TX+1 location,0,0
39,DISYS,Junior Data Analyst,"Tampa, FL+18 locations",PostedToday,$26 an hour,"To do well in this role, you need a very fine eye for detail, experience as a data analyst, and a strong desire to learn proprietary systems are must haves.",Entry Level,Tampa, FL+18 locations,0,0
40,American Unit,Data Protection Analyst,"New York, NY", 6 days ago,$60 - $65 an hour,Symantec is the biggest must have - otherwise need 10+ years of endpoint protection exp.Symantec SME manage security tools production support any antimalware…,Entry Level,New York, NY,0,0
41,DISYS,Junior Data Analyst,"Brandon, FL+18 locations",PostedToday,$26 an hour,"Provide quality assurance of imported data, working with quality assurance analyst if necessary.Supporting initiatives for data integrity and normalization.",Entry Level,Brandon, FL+18 locations,0,0
42,DFS,Data Analyst - Entry Level,"Wilmington, DE 19801 (Southbridge area)",PostedToday,$16 - $19 an hour,"We are seeking candidates interested in starting careers as a claims analyst!*.Ideal candidates are willing to go the extra mile, thrive in a fast paced…",Entry Level,Wilmington, DE 19801 (Southbridge area),0,0
43,Saybrus Partners,Saybrus Partners- Data Reporting Analyst,Remote, 2 days ago,$49629 - $60000 a year,High level comprehension of data being fed into Firm systems from multiple third-parties and can manipulate critical data to ensure it is fed correctly into…,Entry Level,Remote,,0,0
44,The Quaker School at Horsham,Behavior Analyst (BCBA)/Behavior Specialist (LBS),"Horsham, PA 19044+1 location", 7 days ago,$65000 a year,Manage ongoing data collection in the established behavioral health software to establish baseline and analyze data on a frequent and ongoing basis to guide…,Entry Level,Horsham, PA 19044+1 location,0,0
45,Zenni Optical,Data Engineer/Analyst,"Novato, CA",Posted30+ days ago,Full-time,"1-3 years data analyst experience.Analyze data requirements, map current systems and formats to logical and physical data models.",Entry Level,Novato, CA,0,1
46,Dow Jones,Data Analyst,"New York, NY 10176 (Murray Hill area)+3 locations",Posted30+ days ago,Full-time,"Experience cleaning and manipulating messy data.The insights discovered by this data analyst will be presented to senior editors, product managers, and…",Entry Level,New York, NY 10176 (Murray Hill area)+3 locations,0,0
47,Goodway Technologies,Business Analyst,"Stamford, CT 06902 (Waterside area)", 3 days ago,$85000 - $95000 a year,Use data to create models that optimize purchasing patterns based upon historical data and forecast trends.Monitor databases for accuracy and data integrity.,Entry Level,Stamford, CT 06902 (Waterside area),0,0
48,CMK Select,Technical Data Analyst / Manager,Remote,Posted30+ days ago,$65 - $70 an hour,While this sounds simplistic transferring data in this size and quantity often causes data discrepancies.This resource needs to be the first set of eyes to…,Entry Level,Remote,,1,0
49,Orgspire Info Technologies Pvt. Ltd.,Informatica (ETL) Data Analyst,Remote,PostedJust posted,$47 - $52 an hour,"Work Authorization: * Only Independent Contractors.Key Skills: * Informatica (ETL), Data analysis.Strong Data Analyst experience ~ 4+ years.",Mid Level,Remote,,0,0
50,Anthem Sports & Entertainment,Data Analyst,Temporarily Remote,PostedJust posted,Up to $75000 a year,The successful candidate will have a minimum of 3-5 years previous experience as a Digital Business Analyst.Coordinate onboarding of new channels.,Mid Level,Temporarily Remote,,0,0
51,Infipact,Data Analyst,Remote,Posted7 days ago,$50 - $55 an hour,"Location : - Fremont, CA (Remote until Covid subsides).5+ years of exp in writing complex SQL queries- strong SQL experience.Job Types: Full-time, Contract.",Mid Level,Remote,,0,0
52,Matlen Silver,Data Analyst,"Houston, TX+4 locations",PostedJust posted,$52 - $56 an hour,"Experience analyzing weblog data a plus.Lead and help develop more junior analysts.Duration: 6 + Month Contract.Location: Houston, TX 77002 (HYBRID).",Mid Level,Houston, TX+4 locations,0,0
53,Tellus Solutions,Research Analyst I -Multi-omics data analysis REMOTE,Remote,Posted4 days ago,Up to $35 an hour,Prepare each dataset by using data wrangling or data analysis tools or pipelines to generate normalized data matrices or intermediate analysis results.,Mid Level,Remote,,0,0
54,Right Skale Inc.,Data Engineer/Analyst (SQL/ Tableau) – Long Term Contract –...,Remote,Posted4 days ago,$55 - $70 an hour,Develop and optimize data architecture to support the data needs of our rapidly-growing business.Prior experience in creating reports from Salesforce and…,Mid Level,Remote,,0,1
55,Wellthy,Senior Data Analyst,Remote, 5 days ago,$95000 - $136800 a year,You know how to collaborate with data engineers and business stakeholders to design data transformations to better support reporting and analysis and optimize…,Mid Level,Remote,,0,0
56,The Mom Project,Data Analyst,"Menlo Park, CA+5 locations",Posted1 day ago,$68.37 an hour,"Solutions and detail-oriented, with data acumen.Build the infrastructure required for optimal extraction, transformation, and loading of data from a wide…",Mid Level,Menlo Park, CA+5 locations,0,0
57,UtiliSave LLC,Junior Data Analyst,Remote,Posted1 day ago,$40000 - $45000 a year,"Requirements* *3-5 years of experience in a relevant auditing or analyst role.*.Competitive salary commensurate with experience; excellent health, dental and…",Mid Level,Remote,,0,0
58,TikTok,TikTok LIVE Data Analyst,"Los Angeles, CA+11 locations",PostedToday,,"Assist in creating data best practices and documentation to help streamline data operations.Advanced proficiency in data manipulation including SQL, python or…",Mid Level,Los Angeles, CA+11 locations,0,0
59,"Peachjar, Inc.",Data Analyst (Remote within U.S.),"Remote in San Diego, CA",Posted10 days ago,Full-time,"Technical proficiency regarding database design, data models and techniques for data mining and segmentation.3+ years of data experience.",Mid Level,Remote in San Diego, CA,0,0
60,SpanIdea Systems,Data Analyst,"Fremont, CA", 7 days ago,$80000 - $110000 a year,"Experience in Managing End-to-End Tableau projects from data source setup, data extraction, charts selection, and setup tableau dashboards.",Mid Level,Fremont, CA,0,0
61,Zettalogix Inc,Data Analyst,Remote, 3 days ago,$50 - $75 an hour,"Develop and implement data analytics, data collection systems, and other strategies that optimize statistical efficiency and quality.",Mid Level,Remote,,0,0
62,"KAT TECH Systems, Inc.",Data Analyst,Remote, 3 days ago,$50 - $75 an hour,"Gain a deep understanding of the data model, critical data entities and data elements in the.Data warehouse, data marts, and related databases.",Mid Level,Remote,,0,0
63,RYAN Consulting Group,Data Analyst,+1 locationRemote, 8 days ago,$25 - $28 an hour,"Ability to pull and analyze data, manipulate data.We need a Data Analyst that has 1 - 3 years of experience.The role is fully remote.",Mid Level,+1 locationRemote,,0,0
64,Orgspire Info Technologies Pvt. Ltd.,Informatica (ETL) Data Analyst,Remote,PostedJust posted,$47 - $52 an hour,"Key Skills: * Informatica (ETL), Data analysis.Strong Data Analyst experience ~ 4+ years.ETL background ( informatica/datastage / IICS).",Mid Level,Remote,,0,0
65,Infipact,Data Analyst,Remote,Posted7 days ago,$50 - $55 an hour,"5+ years of exp in writing complex SQL queries- strong SQL experience.5+ years of work experience on Oracle platform.Job Types: Full-time, Contract.",Mid Level,Remote,,0,0
66,Matlen Silver,Data Analyst,"Houston, TX+1 location",PostedJust posted,$52 - $56 an hour,Experience analyzing weblog data a plus.Lead and help develop more junior analysts.Apply statistical modeling or machine learning algorithms to optimize…,Mid Level,Houston, TX+1 location,0,0
67,TikTok,TikTok LIVE Data Analyst,"Los Angeles, CA+10 locations",PostedToday,,"Assist in creating data best practices and documentation to help streamline data operations.Advanced proficiency in data manipulation including SQL, python or…",Mid Level,Los Angeles, CA+10 locations,0,0
68,RYAN Consulting Group,Data Analyst,Remote, 8 days ago,$25 - $28 an hour,"Ability to pull and analyze data, manipulate data.We need a Data Analyst that has 1 - 3 years of experience.Ideal experience for the Data Analyst: *.",Mid Level,Remote,,0,0
69,Keypoint Intelligence,Data Analyst/ETL Specialist,"Boston, MA+1 location",Posted4 days ago,$70000 - $120000 a year,"This individual will primarily be tasked with managing various internal data sets, from the initial ETL workflows required to integrate the content into our…",Mid Level,Boston, MA+1 location,0,0
70,LOVEFOODIES INC,Data Analyst,"San Francisco, CA", 2 days ago,$30 - $55 an hour,"SQL. SQL, or Structured Query Language, is the ubiquitous industry-standard database language.Data pipelines in python is required.",Mid Level,San Francisco, CA,0,0
71,W.D.C. Kitchen & Bath Center,Data Analyst,"Moorpark, CA 93021+2 locations",Posted3 days ago,$23 - $25 an hour,Identify inventory differences between physical stock and digital data.Use sales data to forecast & identify trends.Microsoft Excel: 3 years (Preferred).,Mid Level,Moorpark, CA 93021+2 locations,0,0
72,Internal Data Resources,Data Analyst,Remote,Posted1 day ago,Full-time,2+ years of SQL querying data and building data pipelines.Creating end-to-end data pipelines and ETL solutions to create accessible data sets.,Mid Level,Remote,,0,0
73,Connecticut Conference of Municipalities (CCM),Business Intelligence & Data Analyst,"Temporarily Remote in New Haven, CT", 5 days ago,From $50 an hour,Leverage data warehouse and other data sources for business reporting needs.Design and develop complex ETL logic to extend and publish data marts in enterprise…,Mid Level,Temporarily Remote in New Haven, CT,0,0
74,Peraton,Data Analyst - Medicare,"Chantilly, VA+2 locations",PostedToday,Up to $116626 a year,Bachelor's degree and 5-7 Years or Master's degree and 3-5 or PhD 0-2 additional years.We are seeking Data Analyst - Medicare position requires the individual…,Mid Level,Chantilly, VA+2 locations,0,0
75,The Mom Project,Data Analyst,"Menlo Park, CA+3 locations",Posted1 day ago,$68.37 an hour,"Solutions and detail-oriented, with data acumen.Build the infrastructure required for optimal extraction, transformation, and loading of data from a wide…",Mid Level,Menlo Park, CA+3 locations,0,0
76,Kidney Specialists Of Southern Nevada,Healthcare Data Analyst,"Las Vegas, NV 89106 (Rancho Charleston area)", 6 days ago,Full-time,Models data using analytical tools.Preferred experience with claims data analysis.Analyzes data to assist in delivering optimal healthcare management and…,Mid Level,Las Vegas, NV 89106 (Rancho Charleston area),0,0
77,Verizon,Business Intelligence Measurement Manager - Brand & Sponsors...,"Summit, NJ 07902+65 locations",Posted26 days ago,Part-time,The end goal is to ensure strategic and tactical marketing decisions are informed by data-driven insights.Build and manage day-to-day marketing effectiveness…,Mid Level,Summit, NJ 07902+65 locations,1,0
78,American Clouds,Data Analyst,"Remote in New York, NY", 2 days ago,From $35 an hour,"3-5 years of experience working with extremely large datasets, pulling analysis and optimization ETL processing and Machine learning pipelines.",Mid Level,Remote in New York, NY,0,0
79,Rello Search Partners,Data Analyst,"Tampa, FL",PostedJust posted,$75000 - $90000 a year,"Perform trend analysis, analyze data of customers.Rello Search Partners* is searching for a full time Data Analyst with our client in the Tampa area.",Mid Level,Tampa, FL,0,0
80,The Mom Project,Data Analyst,"Menlo Park, CA+2 locations",Posted1 day ago,$68.37 an hour,"Solutions and detail-oriented, with data acumen.Build the infrastructure required for optimal extraction, transformation, and loading of data from a wide…",Mid Level,Menlo Park, CA+2 locations,0,0
81,Oculus,Manufacturing and Supply Chain Data Analyst,+1 locationRemote,Posted7 days ago,,"Aggregation and reporting of manufacturing systems and process data, including MES data, shop floor trend data (equipment and process), metrology raw data,…",Mid Level,+1 locationRemote,,0,0
82,Matlen Silver,Data Analyst,"Houston, TX+4 locations",PostedJust posted,$52 - $56 an hour,Experience analyzing weblog data a plus.Lead and help develop more junior analysts.Apply statistical modeling or machine learning algorithms to optimize…,Mid Level,Houston, TX+4 locations,0,0
83,RYAN Consulting Group,Data Analyst,+1 locationRemote, 8 days ago,$25 - $28 an hour,"Ability to pull and analyze data, manipulate data.We need a Data Analyst that has 1 - 3 years of experience.Ideal experience for the Data Analyst: *.",Mid Level,+1 locationRemote,,0,0
84,"Prime Trust, LLC",Data Analyst I,+1 locationRemote, 2 days ago,$70000 - $75000 a year,About Prime Trust Prime Trust is a technology-driven institution that provides open banking solutions for FinTech innovators. We power financial…,Mid Level,+1 locationRemote,,0,0
85,Orgspire Info Technologies Pvt. Ltd.,Informatica (ETL) Data Analyst,Remote,PostedJust posted,$47 - $52 an hour,"*Work Authorization: * Only Independent Contractors *Key Skills: * Informatica (ETL), Data analysis * Strong Data Analyst experience ~ 4+ years * ETL…",Mid Level,Remote,,0,0
86,"Paragon Insurance Holdings, LLC.",Insurance Data Analyst,"Temporarily Remote in Avon, CT", 6 days ago,$85000 - $100000 a year,"Insurance Data Analyst Paragon Insurance Holdings, LLC *_Paragon Insurance Holdings LLC is a managing general agent in the property and casualty…",Mid Level,Temporarily Remote in Avon, CT,0,0
87,Anthem Sports & Entertainment,Data Analyst,Temporarily Remote,PostedJust posted,Up to $75000 a year,Anthem Sports and Entertainment has an opening in our Digital Content department for a Data Librarian: *Job Responsibilities: * · Responsible for reaching…,Mid Level,Temporarily Remote,,0,0
88,Infipact,Data Analyst,Remote,Posted7 days ago,$50 - $55 an hour,"*Position 2 : - Data Analyst* Location : - Fremont, CA (Remote until Covid subsides) * 5+ years of exp in writing complex SQL queries- strong SQL experience …",Mid Level,Remote,,0,0
89,Matlen Silver,Data Analyst,"Houston, TX+1 location",PostedJust posted,$52 - $56 an hour,"Job Title: Data Analyst Duration: 6 + Month Contract Location: Houston, TX 77002 (HYBRID) W2: $52-$56/hour Responsibilities: Essential Duties/Responsibilities…",Mid Level,Houston, TX+1 location,0,0
90,"Orgill, Inc.",Purchasing Data Analyst,"Collierville, TN 38017+1 location", 12 days ago,Full-time,Great Benefits! Great Team! Great Company! Interested in receiving exceptional benefits? Want to work with a dynamic Product Data team? Then Orgill is the…,Mid Level,Collierville, TN 38017+1 location,0,0
91,Uline,Operations Analyst - Customer Service,"Kenosha, WI 53144+2 locations",Posted30+ days ago,,"Operations Analyst - Customer Service Milwaukee Branch 12355 Uline Way, Kenosha, WI 53144 Customer Service is the heartbeat of our company. We depend on our…",Mid Level,Kenosha, WI 53144+2 locations,0,0
