,company,title,location,job posted date,job salary,summary,Experince Level,City,State,Manager,Engineer
92,Tellus Solutions,Research Analyst I -Multi-omics data analysis REMOTE,Remote,Posted4 days ago,Up to $35 an hour,Job description: * The Immunology Systems Computational Biology (SysComp) Group at the client Cambridge Research Center (CRC) performs computational research…,Mid Level,Remote,,0,0
93,Right Skale Inc.,Data Engineer/Analyst (SQL/ Tableau) – Long Term Contract –...,Remote,Posted4 days ago,$55 - $70 an hour,*Data Engineer/Analyst (SQL/ Tableau) – Long Term Contract – 100% Remote* We are looking to hire a strong Data Engineer/Analyst for our client based in the…,Mid Level,Remote,,0,1
94,Maryland Hospital Association,"Data Analyst, Strategic Analytics","Hybrid remote in Elkridge, MD", 12 days ago,Full-time,"DATA ANALYST, STRATEGIC ANALYTICS The mission of the Maryland Hospital Association (MHA) is to serve Maryland’s hospitals and health systems through…",Mid Level,Hybrid remote in Elkridge, MD,0,0
95,Wellthy,Senior Data Analyst,Remote, 5 days ago,$95000 - $136800 a year,"*Why Wellthy is for you!* Wellthy is a digital care concierge for families with chronic, complex, and ongoing care needs. By tackling the logistical aspects…",Mid Level,Remote,,0,0
96,Greensboro Housing Authority,Data Analyst,"Greensboro, NC 27401 (Fisher Park area)",Posted30+ days ago,Full-time,"Job Opening: DATA ANALYST Greensboro Housing Authority seeks an enthusiastic, career-minded individual with a strong work ethic and commitment to teamwork…",Mid Level,Greensboro, NC 27401 (Fisher Park area),0,0
97,Kerry,Master Data Analyst,"Jackson, WI 53037",PostedToday,Full-time,"Requisition ID 35665 Position Type (US)Full Time Career Function Supply Chain Recruiter Posting Type LI Leading to better encompasses all we do at Kerry, it…",Mid Level,Jackson, WI 53037,0,0
98,Rello Search Partners,Data Analyst,"Tampa, FL",PostedJust posted,$75000 - $90000 a year,Rello Search Partners is searching for a full time Data Analyst with our client in the Tampa area. This company is private equity owned and growing quickly…,Mid Level,Tampa, FL,0,0
99,Matlen Silver,Data Analyst,"Houston, TX+1 location",PostedJust posted,$52 - $56 an hour,"Experience analyzing weblog data a plus.Lead and help develop more junior analysts.Duration: 6 + Month Contract.Location: Houston, TX 77002 (HYBRID).",Mid Level,Houston, TX+1 location,0,0
100,RYAN Consulting Group,Data Analyst,Remote, 8 days ago,$25 - $28 an hour,"Ability to pull and analyze data, manipulate data.We need a Data Analyst that has 1 - 3 years of experience.The role is fully remote.",Mid Level,Remote,,0,0
101,Targa Resources,EAM Data Analyst,"Oklahoma City, OK",Posted18 days ago,,"Create and maintain Maximo data sets and identify added value to existing data sets.Proactively discover hidden relationships within data, solving difficult…",Mid Level,Oklahoma City, OK,0,0
102,Cardea Bio,Data Analyst,"San Diego, CA 92121 (Miramar area)", 2 days ago,$80000 - $108000 a year,"The ideal candidate for this role will have a passion for a detail oriented, statistical approach to scientific data analysis.Able to work full time.",Mid Level,San Diego, CA 92121 (Miramar area),0,0
103,University of Maryland,"Data Analyst, Energy and Utilities","College Park, MD 20742",Posted17 days ago,$52691 - $65864 a year,"Support data collection, reporting (both internally to E&E groups and DGS) along with evaluating anomalies and irregular consumption in utility data.",Mid Level,College Park, MD 20742,0,0
104,Climax Metal Products Company,Junior Business Data Analyst,"Mentor, OH 44060", 2 days ago,$35000 - $50000 a year,Perform data transitions from ERP to CRM.Prepare data for trade shows and customer events.Prepare daily data tracking sheets for CMP Division.,Mid Level,Mentor, OH 44060,0,0
105,The Christian Broadcasting Network,Digital Data Analyst,Remote, 19 days ago,Full-time,"Document analytics configurations for Google Analytics, Google BigQuery, and integrations to third party data sources.Hands on experience with ANSI-SQL.",Mid Level,Remote,,0,0
106,Internal Data Resources,Data Analyst,Remote,Hiring ongoing,Full-time,2+ years of SQL querying data and building data pipelines.Creating end-to-end data pipelines and ETL solutions to create accessible data sets.,Mid Level,Remote,,0,0
107,Liberty Mutual Insurance,"Data Analyst / Sr. Data Analyst, Remote",Remote,Posted4 days ago,$90000 - $142500 a year,"Requires critical thinking, data analysis, data profiling and data modeling experience.Generally, 2 – 5 years of professional experience.",Senior Level,Remote,,0,0
108,Tallon Recruiting and Staffing,Senior Data Analyst - Army HR,"Remote in Arlington, VA",Posted30+ days ago,,"Provides subject-matter expertise and data analysis for data transformation support.Manages efforts with the System Integrator, Functional Management Division,…",Senior Level,Remote in Arlington, VA,0,0
109,SECU Credit Union,Senior Data Analyst,"Remote in Linthicum, MD",Posted30+ days ago,Full-time,"The Senior Data Analyst will conduct exploratory data analysis, statistical analysis, data visualization predictive modeling and forecasting to produce…",Senior Level,Remote in Linthicum, MD,0,0
110,X2Logics,Sr. Data Analyst,Remote,PostedJust posted,$60 - $65 an hour,"We are looking for a data analyst who will be responsible for coordinating the changes to computer databases, test, and implement the database applying…",Senior Level,Remote,,0,0
111,Labcorp,Senior Clinical Content Analyst,"Durham, NC 27709",Posted30+ days ago,,"In addition to content development, the analyst will be responsible for maintaining clear and concise documentation of all algorithms, recommendations, and…",Senior Level,Durham, NC 27709,0,0
112,Envision,Sr. Business Analyst,Remote in Missouri,Posted4 days ago,,"Experience developing data and process flows.Implements strategies for gathering, reviewing and analyzing data requirements.",Senior Level,Remote in Missouri,,0,0
113,FrontierBPM,Senior Data and Reporting Analyst,Remote,Posted1 day ago,From $40 an hour,Data reporting: 5 years (Preferred).Integrates data from multiple sources to produce requested or required data elements.,Senior Level,Remote,,0,0
114,"Professional Technology Integration, Inc.",Sr. Data Analyst,"Atlanta, GA 30303 (Five Points area)",Posted15 days ago,,Understand data source systems and downstream data applications.Experience using extremely large data sets (Required 5 Years).,Senior Level,Atlanta, GA 30303 (Five Points area),0,0
115,Bank of America,Data Support Sr Analyst,"Charlotte, NC 28202 (First Ward area)+3 locations",PostedJust posted,Full-time,Establish and build trusted advisor relationships across the internal and external Credit Risk data community and act as subject matter expert on Credit Risk…,Senior Level,Charlotte, NC 28202 (First Ward area)+3 locations,0,0
116,Strategic Employment Partners,Senior Data Analyst,Remote,Posted3 days ago,Full-time,"5+ years of professional experience as a *Data Analyst*.Strong experience writing *SQL – complex queries*, etc.",Senior Level,Remote,,0,0
117,Apptrics LLC,Sr. Data Analyst,"Atlanta, GA 30303 (Downtown area)", 13 days ago,$36 - $40 an hour,Using extremely large data sets: 5 years (Required).General understanding of data integrity.Experience using extremely large data sets.,Senior Level,Atlanta, GA 30303 (Downtown area),0,0
118,"Athreya, Inc.",Senior Data Analyst,"Milpitas, CA 95035",Posted11 days ago,$55 - $65 an hour,"Data Analyst who can help with data and presentation work across strategy and Biz Ops, analyze the raw financial, SaaS, Workforce data to create exec summaries.",Senior Level,Milpitas, CA 95035,0,0
119,Blue Cross and Blue Shield of Minnesota,Senior Data Analyst,+1 locationRemote,Posted1 day ago,From $90000 a year,"Familiarity with data analysis concepts and data modeling tools.Recommends development process improvements, partners with development teams to capture data…",Senior Level,+1 locationRemote,,0,0
120,Kutir Corporation,Senior Data Analyst,"Remote in Jacksonville, FL", 1 day ago,$55034 - $126560 a year,Data warehouse: 5 years (Preferred).Data Analyst: 10 years (Preferred).Data analytics: 8 years (Preferred).,Senior Level,Remote in Jacksonville, FL,0,0
121,Zenernet,Senior Data Analyst/Data Scientist,Remote,Posted2 days ago,$100000 - $120000 a year,"Knowledge of connecting and mapping data sources in Tableau.You will start with an untouched Tableau environment, map data, and create a data-driven reporting…",Senior Level,Remote,,0,0
122,Indeed,Senior Data Governance Analyst,Remote,Posted30+ days ago,$94000 - $136000 a year,"6+ years industry experience as a business analyst, data analyst, data governance analyst, or in a data quality management role.",Senior Level,Remote,,0,0
123,LOCFIT LLC,Senior SAS/Python Data Analyst (Salary up to 160k),"Temporarily Remote in Washington, DC", 3 days ago,$120000 - $160000 a year,"Candidates should also be knowledgeable in data visualization, and large data manipulation.--Ten (10) years of relevant experience (a Masters or CFA may…",Senior Level,Temporarily Remote in Washington, DC,0,0
124,Online Technical Services,Senior Data Analyst - Data Warehouse Consultant,"San Jose, CA 95112 (Downtown area)",PostedJust posted,$110 - $120 an hour,"Familiarity with Social Services systems and data sources a plus.Experienced with relational database, querying, data extraction and scripting.",Senior Level,San Jose, CA 95112 (Downtown area),0,0
125,Brooksource,Senior Data Governance Analyst,Missouri,Posted30+ days ago,$78000 - $115000 a year,Identifies data challenges and issues regarding data quality.Serves as liaison with data source specialists for data standardization and consistency.,Senior Level,Missouri,,0,0
126,InterraIT,Looking for Data Privacy Analyst,Remote, 7 days ago,$60 - $65 an hour,Establishes and maintains Risk and Compliance policies and assumes ownership for programs which promote risk management and ensure compliance to regulatory…,Senior Level,Remote,,0,0
127,AgreeYa Solutions,Sr Data Analyst,Remote,Posted5 days ago,Full-time +1,"Data mapping: 3 years (Required).Works independently to improve data quality, data collection and analysis processes; develops data modelling methodologies and…",Senior Level,Remote,,0,0
128,Vaco,Senior Data Analyst | Upto $70/hr,"Oakland, CA+1 location",Posted26 days ago,Up to $70 an hour,"We are looking for a candidate with strong SQL, python, and data visualization skills.**Must be in Oakland, CA or commutable distance***.",Senior Level,Oakland, CA+1 location,0,0
129,Eteam Infoservices Private Limited,Senior Data Analyst,"Charlotte, NC", 12 days ago,$55 - $60 an hour,The client is looking for two Senior Data Analysts to support our Enterprise Data Governance Program initiatives focused on data quality and analytics.,Senior Level,Charlotte, NC,0,0
130,Aquent,Data Analyst,"Dallas, TX",Posted20 days ago,$75 an hour,"Capacity to handle priorities with a data-driven mindset.Strong experience of Web/App, digital & data analytics.",Senior Level,Dallas, TX,0,0
131,Agama Solutions,Data Automation Analyst,"Summit, NJ",Posted4 days ago,$32 - $55 an hour,"7+ years of experience working with business partners on requirements, data design, data analysis.Experience with programming tools like Python, SQL, Java for…",Senior Level,Summit, NJ,0,0
132,Cerebral,Senior Data Analyst,Remote in California+1 location,Posted30+ days ago,Full-time,"Collaborate with data science, engineering, and business-focused colleagues to inform data and client related decisions, automate data processes, and determine…",Senior Level,Remote in California+1 location,,0,0
133,Shop-Ware,Senior Data Analyst,Remote, 7 days ago,$100000 - $115000 a year,Proven track record of success in data analysis and data science for a software company -- bonus points if you've done this for a niche industry.,Senior Level,Remote,,0,0
134,The Home Depot,Senior Cybersecurity Analyst (Remote),"Remote in Atlanta, GA+1 location",Posted1 day ago,$100000 - $180000 a year,"Collaborates with cross functional teams to collect, analyze data, presents results and provides recommendations.Must be eighteen years of age or older.",Senior Level,Remote in Atlanta, GA+1 location,0,0
135,AgreeYa Solutions,Sr Data Analyst,Remote,Posted5 days ago,Full-time +1,"Data mapping: 3 years (Required).Somewhat of a hybrid business analyst and data analytics role, but must be technical.Data analysis: 7 years (Required).",Senior Level,Remote,,0,0
136,X2Logics,Sr. Data Analyst,+1 locationRemote,PostedJust posted,$60 - $65 an hour,"We are looking for a data analyst who will be responsible for coordinating the changes to computer databases, test, and implement the database applying…",Senior Level,+1 locationRemote,,0,0
137,Vaco,Senior Data Analyst | Upto $70/hr,"Oakland, CA",Posted26 days ago,Up to $70 an hour,"We are looking for a candidate with strong SQL, python, and data visualization skills.**Must be in Oakland, CA or commutable distance***.",Senior Level,Oakland, CA,0,0
138,FrontierBPM,Senior Data and Reporting Analyst,Remote,Posted1 day ago,From $40 an hour,Data reporting: 5 years (Preferred).Integrates data from multiple sources to produce requested or required data elements.Pay: From $40.00 per hour.,Senior Level,Remote,,0,0
139,Bank of America,Data Support Sr Analyst,"Charlotte, NC 28202 (First Ward area)",PostedJust posted,Full-time,Establish and build trusted advisor relationships across the internal and external Credit Risk data community and act as subject matter expert on Credit Risk…,Senior Level,Charlotte, NC 28202 (First Ward area),0,0
140,Apptrics LLC,Sr. Data Analyst,"Atlanta, GA 30303 (Downtown area)+1 location", 13 days ago,$36 - $40 an hour,Using extremely large data sets: 5 years (Required).General understanding of data integrity.Experience using extremely large data sets.,Senior Level,Atlanta, GA 30303 (Downtown area)+1 location,0,0
141,Strategic Employment Partners,Senior Data Analyst,Remote,Posted3 days ago,Full-time,The company has been around for almost 10 years and the data analytics team has played an integral part in the company's success.Salary: * up to $135K.,Senior Level,Remote,,0,0
142,Blue Cross and Blue Shield of Minnesota,Senior Data Analyst,+2 locationsRemote,Posted1 day ago,From $90000 a year,"Familiarity with data analysis concepts and data modeling tools.Recommends development process improvements, partners with development teams to capture data…",Senior Level,+2 locationsRemote,,0,0
143,Kutir Corporation,Senior Data Analyst,"Remote in Jacksonville, FL", 1 day ago,$55034 - $126560 a year,"Data warehouse: 5 years (Preferred).Job Title: Senior Data Analyst*.Location: 100% Remote - (Jacksonville, FL)*.Employment Terms: Fulltime with benefits*.",Senior Level,Remote in Jacksonville, FL,0,0
144,Zenernet,Senior Data Analyst/Data Scientist,Remote,Posted2 days ago,$100000 - $120000 a year,We are seeking to immediately add a data scientist/data analyst to our team who will build our business analytics ecosystem with Tableau as our visualization…,Senior Level,Remote,,0,0
145,Liberty Mutual Insurance,"Data Analyst / Sr. Data Analyst, Remote",+1 locationRemote,Posted4 days ago,$90000 - $142500 a year,"Requires critical thinking, data analysis, data profiling and data modeling experience.Generally, 2 – 5 years of professional experience.",Senior Level,+1 locationRemote,,0,0
146,The Home Depot,Senior Cybersecurity Analyst (Remote),"Remote in Atlanta, GA+1 location",Posted1 day ago,$100000 - $180000 a year,Position Purpose: Protecting what matters most to our associates and consumers by securing our sensitive data and critical assets from current and emerging…,Senior Level,Remote in Atlanta, GA+1 location,0,0
147,Liberty Mutual Insurance,"Data Analyst / Sr. Data Analyst, Remote",Remote,Posted4 days ago,$90000 - $142500 a year,"At Liberty Mutual, our purpose is to help people embrace today and confidently pursue tomorrow. That's why we provide an environment focused on openness,…",Senior Level,Remote,,0,0
148,FrontierBPM,Senior Data and Reporting Analyst,Remote,Posted1 day ago,From $40 an hour,*\*\*NO 3rd PARTY APPLICATIONS-DIRECT SUBMISSIONS ONLY\*\** *Job Title: Senior Data & Reporting Analyst* *No Sponsorship-**U.S. Citizen or Full Green Card…,Senior Level,Remote,,0,0
149,Aquent,Data Analyst,"Dallas, TX",Posted20 days ago,$75 an hour,Location: Dallas Job Terms: Temporary Salary: 75 Start date: 02/14/2022 Posted By: Katina Modest Date: 02/01/2022 Job Description: Exciting new role as Data…,Senior Level,Dallas, TX,0,0
150,Vaco,Senior Data Analyst | Upto $70/hr,"Oakland, CA+1 location",Posted26 days ago,Up to $70 an hour,"***Sr. Data Analyst*** ***Must be in Oakland, CA or commutable distance*** ***6 Months (Possible Extensions/Conversion)*** ***Upto $70/hr on W2*** ***NO C2C…",Senior Level,Oakland, CA+1 location,0,0
151,Bank of America,Data Support Sr Analyst,"Charlotte, NC 28202 (First Ward area)+3 locations",PostedJust posted,Full-time,"Job Description: Part of a team responsible for the interpretation, design, implementation and sustainment of best-in-class data management practices in…",Senior Level,Charlotte, NC 28202 (First Ward area)+3 locations,0,0
152,Strategic Employment Partners,Senior Data Analyst,Remote,Posted3 days ago,Full-time,"A *leading, high-traffic online marketplace* is hiring for a *Senior Data Analyst* to be the newest member of their data analytics team! The company has been…",Senior Level,Remote,,0,0
153,Apptrics LLC,Sr. Data Analyst,"Atlanta, GA 30303 (Downtown area)", 13 days ago,$36 - $40 an hour,"*Job Title : **Sr. Data Analyst-DFCS-Performance Planning and Reporting* *Duration: 5+ Months* *Location: **2 Peachtree St. NW, Atlanta, Georgia 30303*…",Senior Level,Atlanta, GA 30303 (Downtown area),0,0
154,"Athreya, Inc.",Senior Data Analyst,"Milpitas, CA 95035",Posted11 days ago,$55 - $65 an hour,"Job Description: As a Senior Data Analyst in Data Analytics unit you will be part of a fast-paced team designing, developing, testing, integrating, and…",Senior Level,Milpitas, CA 95035,0,0
155,Blue Cross and Blue Shield of Minnesota,Senior Data Analyst,+1 locationRemote,Posted1 day ago,From $90000 a year,Blue Cross and Blue Shield of Minnesota is one of the most recognized and trusted health care brands in the world with 2.9 million members. We’re committed to…,Senior Level,+1 locationRemote,,0,0
156,Eteam Infoservices Private Limited,Senior Data Analyst,"Charlotte, NC", 12 days ago,$55 - $60 an hour,post1 Job Description: The client is looking for two Senior Data Analysts to support our Enterprise Data Governance Program initiatives focused on data…,Senior Level,Charlotte, NC,0,0
157,Kutir Corporation,Senior Data Analyst,"Remote in Jacksonville, FL", 1 day ago,$55034 - $126560 a year,"*Job Title: Senior Data Analyst* *Location: 100% Remote - (Jacksonville, FL)* *Employment Terms: Fulltime with benefits* *Required Skills: * * Data…",Senior Level,Remote in Jacksonville, FL,0,0
158,Zenernet,Senior Data Analyst/Data Scientist,Remote,Posted2 days ago,$100000 - $120000 a year,Zenernet is the industry-leading provider of residential solar energy solutions across the United States. We are technology-driven and scaling fast. We are…,Senior Level,Remote,,0,0
159,Indeed,Senior Data Governance Analyst,Remote,Posted30+ days ago,$94000 - $136000 a year,"Your Job Our mission is to empower Indeedians to manage data using best practices. As a Data Governance Analyst, you will have a direct impact on the…",Senior Level,Remote,,0,0
160,Aquent,Data Analyst,"Dallas, TX",Posted20 days ago,$75 an hour,"Capacity to handle priorities with a data-driven mindset.Strong experience of Web/App, digital & data analytics.Experience in retail/multichannel businesses.",Senior Level,Dallas, TX,0,0
161,Overhead Door Corporation,"Sr, IT Business Analyst","Lewisville, TX+1 location", 2 days ago,Full-time,"The Enterprise Application Business Analyst will work as a member of Overhead Door’s Enterprise Application team to implement, support, and enhance our Oracle…",Senior Level,Lewisville, TX+1 location,0,0
162,Exelon Corporation,Sr Business Analyst - Oakbrook,"Oak Brook, IL 60523+16 locations",Posted1 day ago,,Planning for data management and data analysis activities and recommend new / different technologies to enhance current system and help the team push towards…,Senior Level,Oak Brook, IL 60523+16 locations,0,0
163,Ursus,Sr. SQL Data Analyst,"Remote in Rancho Cordova, CA",Posted4 days ago,Contract,"Works independently to improve data quality, data collection and analysis processes; develops data modeling methodologies and report design to meet diverse and…",Senior Level,Remote in Rancho Cordova, CA,0,0
164,Mitchell International,Remote Senior Data Informatics Analyst 1,"Remote in San Diego, CA",Posted26 days ago,Full-time,Integrates data from multiple sources to produce requested or required data elements.Generates ad hoc reports and regular datasets or report information for…,Senior Level,Remote in San Diego, CA,0,0
165,Procom,"Data Analyst, U.S. Data Strategy - 331792","New York, NY",Posted8 days ago,Contract,"Experience with data projects involving concepts and processes related to data management, such as Critical Data Elements (CDEs), data architecture, data models…",Senior Level,New York, NY,0,0
166,Aquent,Data Analyst,"Dallas, TX+1 location",Posted20 days ago,$75 an hour,"Capacity to handle priorities with a data-driven mindset.Strong experience of Web/App, digital & data analytics.",Senior Level,Dallas, TX+1 location,0,0
167,"Chick-fil-A, Inc.","Sr. Business Analyst, Data Privacy","Atlanta, GA 30349+1 location",Posted25 days ago,,Familiarity with US and International data privacy regulations.2-5 years relevant work experience.You will serve as a subject matter expert for privacy…,Senior Level,Atlanta, GA 30349+1 location,0,0
168,Crescent Bank,Sr Business Analyst,"Carrollton, TX 75006+1 location",Posted30+ days ago,Full-time,"They will be able to apply knowledge of business and use balanced judgment in interpretation of data (analytics).Medical, Dental, and Vision Insurance.",Senior Level,Carrollton, TX 75006+1 location,0,0
169,Madison Reed,Sr. Data Analyst - Marketing Analytics (Remote),"Remote in San Francisco, CA+1 location",Posted30+ days ago,,"2 - 4 years of professional experience in data analysis, data visualization and business intelligence.Write SQL queries to pull and manipulate data.",Senior Level,Remote in San Francisco, CA+1 location,0,0
170,NIKE INC,"Data Science Director, Global Commercial Analytics (Open to...","Remote in Portland, OR+4 locations",PostedJust posted,$157500 a year,Evangelize data science and help senior leadership identify business areas where data science will make the biggest impact.,Senior Level,Remote in Portland, OR+4 locations,0,0
171,Meridian Technologies,Senior Business Analyst,"Houston, TX 77002 (Downtown area)", 5 days ago,$70 - $80 an hour,"Conducts highly complex business process analyses, needs assessments, and preliminary cost/benefit analyses in an effort to align information technology…",Senior Level,Houston, TX 77002 (Downtown area),0,0
172,firstPRO Inc.,Senior Project Business Analyst,"Philadelphia, PA+1 location",Posted13 days ago,$60 - $65 an hour,"Five (5) years of business analysis experience.Three (3) years of project management experience in small-to-medium initiatives.Job Types: Full-time, Contract.",Senior Level,Philadelphia, PA+1 location,0,0
173,"A. Duie Pyle, INC.",Sr. Business Intelligence Analyst,"West Chester, PA 19382+6 locations",Posted11 days ago,Full-time,"3 or more years experience in performing data reporting, data warehouse and Business Intelligence (BI).Perform logical and physical data modeling to support…",Senior Level,West Chester, PA 19382+6 locations,0,0
174,Lendistry,Senior Data Analyst,Remote, 4 days ago,Full-time,"5 years’ experience in data analysis in a professional setting.Work closely with data engineering, product, and business teams to develop, design, and maintain…",Senior Level,Remote,,0,0
175,Scientific Systems and Software International...,Database BI Analyst/WebFOCUS - Ref.: SSSI.50.C3,"Catonsville, MD 21228", 29 days ago,$60000 - $65000 a year,"Minimum of 5 years of experience working in various SDLC frameworks (e.g. Agile, Waterfall) as a Systems Analyst to elicit and document requirements and…",Senior Level,Catonsville, MD 21228,0,0
176,Indeed,Senior Business Analyst,"Austin, TX",Posted30+ days ago,$74000 - $108000 a year,Proficient in manipulating data sets in SQL or equivalent and drawing insights from data.Apply advanced business analyst tools/techniques and develop a breadth…,Senior Level,Austin, TX,0,0
177,Vaco,Senior Data Analyst | Upto $70/hr,"Oakland, CA+1 location",Posted27 days ago,Up to $70 an hour,"We are looking for a candidate with strong SQL, python, and data visualization skills.**Must be in Oakland, CA or commutable distance***.",Senior Level,Oakland, CA+1 location,0,0
178,HCL Technologies,Sr Master Data Management (MDM) Architect/Analyst,Remote, 12 days ago,$61120 - $150129 a year,"HCL seeks a Sr Master Data Management (MDM) Architect/Analyst for a full-time employment opportunity in Hartford, CT.Should have worked on Multi Domain MDM.",Senior Level,Remote,,0,0
179,Catchpoint,"Director, Data Analytics",Remote,Posted25 days ago,,"Experience and comfort with data – understanding data, synthesizing and visualizing actionable insights.Catchpoint is looking for a business intelligence/ data…",Senior Level,Remote,,0,0
